"J'adore les patates, surtout les pommes de terres au four ou sautées. Par contre j'aime pas les legumes, c'est pas bon."
"Je me demande s'il fera beau demain. J'ai pas envie qu'il fasse trop froid."
"Il pleut!!!!!!!!!!!! Mais ca va pas durer apparemment :/ C'est un peu triste car j'adore la pluie, mais en même temps la plus part des gens aiment pas."
"J'écrit des textes pour mon uv d'info, mais j'ai pas d'idée sur quoi écrire. Du coup j'écrit ce qu'i me passe par la tête ^^"
"Hé regardez, elle est trop stylée la vidéo !!!"
"J'ai trouvé cette image, vous en pensez quoi ??"
"J'ai créer un programme C. Dans ce-dernier je crée un fils, puis j'utilise la fonction 'kill' afin d'envoyer un signal SIGUSR1 au père. Cependant je n'arrive pas a traiter correctement le signal. Comment faites-vous ?"